{
  "schema_id": "mediahub.ai.ai-provider",
  "schema_version": "1.0.0",
  "owner": "mediahub-ai",
  "provider_id": "openrouter-glm52",
  "provider_type": "remote",
  "model": "z-ai/glm-5.2",
  "capabilities": [
    "text",
    "reasoning",
    "tool_calling",
    "structured_output"
  ],
  "endpoint": "https://openrouter.ai/api/v1",
  "authentication": "api_key",
  "availability": "unknown",
  "reason": "Cloud provider contract. Availability is resolved at runtime; no credential is stored in the repository."
}
